t1	t2	type
in the media there is quite a lot of blame	there’s quite a substantial element of blame of the people who are so called ‘undeserving’, even if Neil doesn't accept the term	0
in the media there is quite a lot of blame	we need to think about how to describe the problem, and understand the problem accurately	0
It’s been done to them, not done by them	we don’t want to blame them for that	0
that’s not right	we need to think about how to describe the problem, and understand the problem accurately	0
that’s not right	it is ‘scroungers	1
The way Neil would describe a lot of the people Neil's met who have been long term unemployed is kind of defeated, kind of depressed	that’s not right	0
the Department of Work and Pensions did a survey of people who have been on benefits a couple of years ago	it is true	0
they found that 11% of people who were on benefits said that they felt fully justified being on benefits and have discovered that life without the added complication of work has much to recommend it	you’ve got about 30% of claimants who’ve got some sort of attitudinal problem	0
let’s not just call them ‘scroungers’	it is ‘scroungers	1
they are somehow or another demoralized and broken	The way Neil would describe a lot of the people Neil's met who have been long term unemployed is kind of defeated, kind of depressed	2
that does seem to correspond to the reality	we don’t want to blame them for that	0
It’s not overwhelming	the urge to get a job is overwhelming	1
it’s obvious	It’s not overwhelming	0
if there were twice as many jobs available, unemployment would fall drastically	It’s not overwhelming	1
It does happen	that’s begging a lot of questions	1
you can see the curves moving together	It does happen	0
They go up, they go down	you can see the curves moving together	0
If there were twice as many jobs available than there are now, unemployment would fall drastically	if there were twice as many jobs available, unemployment would fall drastically	2
that’s begging a lot of questions	If there were twice as many jobs available than there are now, unemployment would fall drastically	1
there’s a short-term relationship, but no necessarily a long term one	They go up, they go down	0
there is a no utopia	JB didn’t refer to utopia	0
people like KM who believe as a utopia, are precisely the ones who have led to bad policies and bad results.	there is a no utopia	0
It is the illusion that there is a utopia that has led to the idea that you can give people money for not working, and that will cause no perverse results	people like KM who believe as a utopia, are precisely the ones who have led to bad policies and bad results.	0
it’s compulsion	It’s not incentives	0
it’s requirement	It’s not incentives	0
we are just providing the work that people want to do	incentives and compulsions are irrelevant.	0
the desire to work is innate	incentives and compulsions are irrelevant.	0
It’s creative	the desire to work is innate	0
It’s not incentives	incentives are irrelevant	1
the desire to work is innate	people would require the social context in which work happens	0
they enjoy that	the desire to work is innate	2
they want the relationships that go with work	people would require the social context in which work happens	0
JB doesn't know whether it is innate or not	the desire to work is innate	2
JB's no idea whether it’s innate	JB doesn't know whether it is innate or not	2
it is not	the desire to work is innate	1
abolishing housing benefit for under 25s will lead to homelessness, hidden homelessness, sofa surfing, staying with the wrong people	one of the big initiatives that Romin's looking at, is the troubled families initiative; this idea that this hardcore of really difficult families that we need to look at	0
abolishing housing benefit for under 25s will lead to homelessness, hidden homelessness, sofa surfing, staying with the wrong people	Romin is overstating Romin's case, and at the same time treating young people as though they won’t cope with living in a garret, bit of poverty but I’ll get by	1
abolishing housing benefit for under 25s will lead to staying with your mates	abolishing housing benefit for under 25s will lead to homelessness, hidden homelessness, sofa surfing, staying with the wrong people	2
it's not innate	we have to bribe people	0
it's not innate	we have to starve people	0
it's not innate	people can be tempted out of work	0
If you’re going to work very hard for 8 hours a day, 5 days a week and you’re going to make only £1 more than you would have made on benefits the urge to get a job is not as strong as it would be if you’d otherwise be penniless	people can be tempted out of work	0
Before this recession, and forget whether Cameron is motivated by cuts or not, there was an ever increasingly welfare dependency	a lot of young people sort of, had a sense of entitlement, which wasn't very healthy	0
That’s not good	young people should go out and get something from the world, contribute something to the world. Instead of saying “Why can’t I get a well paid job? Why can’t I get a house?”	0
they should really be angry with their government for not addressing the underlying social policy issues	they shouldn’t be angry with young people who are making use of the welfare state	0
that’s fair enough	what we need is more houses	0
Claire wants to encourage a society that treats people as grown ups; that allows them to grow up	eighteen plus're kind of overgrown children	1
it sort of goes back to the hypothetical couple living with their parents that Cameron spoke about in his speech on Monday. This couple who will say to Romin that I’m very angry that Romin sees these other people	That’s not good	1
that’s overstating it	If we don’t give more benefits, more welfare, we’re going to end up with homeless young people everywhere, destitution and so on	1
what we need is more houses	If we don’t give more benefits, more welfare, we’re going to end up with homeless young people everywhere, destitution and so on	2
It is a safety net	the welfare state, as it is, is a safety net / is a trap	2
JB likens it to a mouse trap which has a rather stale piece of cheese in it	it is also very much a trap	0
it’s not particularly attractive	JB likens it to a mouse trap which has a rather stale piece of cheese in it	0
That’s how JB regards it	JB likens it to a mouse trap which has a rather stale piece of cheese in it	2
there’s certainly an argument to look at re-introducing a contributory principle back in to welfare. Something like the French system where if you lose your job you get 70% of your previous wage for a limited period	xxx is the sort of conditionality; or sort of duties RS would expect people on benefit to undertake, in return for that support	2
People move, in a life course, move in and out of work	there’s certainly an argument to look at re-introducing a contributory principle back in to welfare. Something like the French system where if you lose your job you get 70% of your previous wage for a limited period	0
the young guy wasn’t turning up to work on time	the young guy’d lost his job at Tesco	0
This guy’s just a scrounger, he needs a kick up the backside to get going	the young guy was smoking a lot of spliff	0
If you took the people around this table this evening, and you took away all of our contacts, our qualifications our great jobs and so on, we’d still have more internal resources than that guy	we need to think about, how we have a more paternalist system for people like that	0
We’d still be much better off	If you took the people around this table this evening, and you took away all of our contacts, our qualifications our great jobs and so on, we’d still have more internal resources than that guy	2
there has not been a transfer	there’s been a transfer	1
what’s happened is, there’s been a huge and permanent increase in the number of people who are unemployed	there has not been a transfer	0
we were just looking at the claimant count, a very narrow measure of unemployment	We kidded ourselves during the last decade that we’d solved the problem of unemployment,	0
If you look at the wider measure of all the people on benefits: the people on incapacity benefit, the people on income support as well. Actually, even all the way through the years of the debt fuelled boom we had about 5 million people effectively workless	We need to think much harder about how we can make the benefit system, the whole welfare state much more activating, how we can help to get those people into work	0
the young guy was smoking a lot of spliff	the young guy wasn’t turning up to work on time	0
we need to think about, how we have a more paternalist system for people like that	This guy’s just a scrounger, he needs a kick up the backside to get going	1
we’ve had the benefits, whatever they are, from our family of being set up in such a way that we understand the world of working and how to get on in life	We’d still be much better off	0
the reality is that in the last ten or twenty years there’s been a massive transfer of wealth from the poor to the rich, and from the young to the old, and that what Neil's really trying to do is to justify that by blaming the poor for their position	If you took the people around this table this evening, and you took away all of our contacts, our qualifications our great jobs and so on, we’d still have more internal resources than that guy	1
Neil's not trying to justify anything	the reality is that in the last ten or twenty years there’s been a massive transfer of wealth from the poor to the rich, and from the young to the old, and that what Neil's really trying to do is to justify that by blaming the poor for their position	1
there’s been a transfer	the reality is that in the last ten or twenty years there’s been a massive transfer of wealth from the poor to the rich, and from the young to the old, and that what Neil's really trying to do is to justify that by blaming the poor for their position	2
the sense of individual self-reliance, and standing on your own two feet and doing everything to avoid taking money from the state has not been chipped away at by the growth of welfarism	it’s a problem that the sense of individual self-reliance, and standing on your own two feet and actually doing everything to avoid taking money from the state because you want to be politically independent and morally and individually independent has been sapped away at, chipped away at by the growth of welfarsim	1
the growth of what Claire calls ‘welfarism’ is to do with, firstly the disappearance of so many skilled middle income jobs; and secondly due to the failure to build social housing	the sense of individual self-reliance, and standing on your own two feet and doing everything to avoid taking money from the state has not been chipped away at by the growth of welfarism	0
the growth of what Claire calls ‘welfarism’ is to do with, firstly the disappearance of so many skilled middle income jobs; and secondly due to the failure to build social housing	‘The Daily Telegraph’ pointed out there are 23 people chasing every job in this country	0
‘The Daily Telegraph’ pointed out there are 23 people chasing every job in this country	The official unemployment figure, again Neil has a point on this, is understating the real crisis	0
lots of people are doing part time work	There are a number of people competing for work	0
they can’t get full time work	lots of people are doing part time work	0
that’s a crucial difference	That’s the difference	2
the idea behind it was that it would be for periods of sporadic unemployment	the point about a welfare state is it was set up as a safety net, during a time of near full employment	0
There are a number of people competing for work	‘The Daily Telegraph’ pointed out there are 23 people chasing every job in this country	0
‘The Daily Telegraph’ pointed out there are 23 people chasing every job in this country	The reason that the number of people on benefits has soared, is simply because the jobs that once existed disappeared	0
Housing benefit has not a debilitating ?effect	housing benefit, particularly when paid out very young to so many young people, has a debilitating-	1
Owen has answered Anne's question	Owen seems to be finding every which way not to answer Anne's very sensible question	1
Anne's misunderstood the nature of housing benefit	Anne's completely misunderstood the point of housing benefit	2
Owen hasn't answered Anne's question	Owen has answered Anne's question	1
Owen's problem is that Owen will not say whether Owen finds it inherently undesirable or not, or that it leads to a situation which is very bad because it traps people	Owen hasn't answered Anne's question	0
it must be the day job	Anne's misunderstood the nature of housing benefit	0
housing benefit, particularly when paid out very young to so many young people, has a debilitating-	that it is a problem	2
At this current time, the current context without social housing, with 5 million people on social housing waiting lists, people - of course they should claim housing benefit, if they are unable to pay what are extortionate rents. Particularly in places like London	that it is a problem	1
that’s not their fault	At this current time, the current context without social housing, with 5 million people on social housing waiting lists, people - of course they should claim housing benefit, if they are unable to pay what are extortionate rents. Particularly in places like London	0
It doesn’t go to the tenant	Housing benefit has not a debilitating ?effect	0
Owen seems to be finding every which way not to answer Anne's very sensible question	Anne's completely misunderstood the point of housing benefit	1
Owen is the champion of the working class	Owen's problem is that Owen will not say whether Owen finds it inherently undesirable or not, or that it leads to a situation which is very bad because it traps people	0
there are lots of ways in which you can hopefully allow the market to create jobs	there’s the rub	0
there are lots of ways in which you can hopefully allow the market to create jobs	If the market doesn’t, for whatever reason never mind who’s fault it is, then the next thing that the government should do, is to provide jobs for these people to do	0
it’s because of government interference	If the market doesn’t, for whatever reason it’s because of the failure of Capitalism	1
If people want to work, if it’s their nature to work, and if the work was there, then they’d go and do it	that undermines the whole argument that you make about incentives	1
there’s the rub	the fundamental duty we have as a society towards the unemployed is to make sure there are enough jobs for them to take the opportunity to go and work	0
There’s historically been some resistance from ordinary working class people to actually taking state benefits	since this government’s come to power they’ve tried to exploit tensions in working class Britain between the working poor and the unemployed; between the non-disabled and the disabled; between private sector workers and public sector workers	0
if you wanted to pay to work and to create a culture of work, it might be useful to have work in the first place, to have proper jobs at proper wages in the first place	the moral problem is that of how to provide incentives to get people off welfare, into work	1
that would be great	it would be wonderful if politicians could just snap their fingers and create millions of jobs	2
that majority doesn't include CL	that majority includes / does not include CL	1
there is very great danger here of stirring up resentment towards people who need welfare to keep house and home together	that majority doesn't include CL	0
that’s very dangerous to the solidarity, which civilization requires	there is very great danger here of stirring up resentment towards people who need welfare to keep house and home together	0
they’re not naturally lazy	people are naturally creative and industrious, and want to work	0
That worries CL very much	Cameron’s concerns resonate with perhaps the majority	1
people are naturally creative and industrious, and want to work	people are incentivised to remain unemployed	1
unemployment is a crime not a personal tragedy	it’s going back to the politics of the poor house	0
Nothing JB said implies that JB regards it as a crime	JB didn't say that	0
JB would want to abolish the welfare state altogether	If it were politically possible, JB would / would not want to abolish the welfare state altogether	2
JB would want to abolish the welfare state altogether	it’s going back to the politics of the poor house	0
unemployment is a state out of which everybody could get, if the government didn’t get in the way	xxx is how JB regards it	2
that’s an ‘Aunt Sally’	Clifford was swayed by James and Neil to discover that James and Neil weren’t saying that everyone was feckless, lazy scroungers	0
that’s an ‘Aunt Sally’	What is important at this point is that there has to be a serious discussion about the impact of welfarism	0
If you’re staying on your mates coach and all the rest of it, and you get a job, you want to prove that you’re going to not just kind of go “Oh well, it’s not that much money.” You’ll use it, that’s what you want.	What is important at this point is that there has to be a serious discussion about the impact of welfarism	0
Claire has an answer to Neil's complaint that the market in housing has seriously distorted the housing benefit	Claire has no answer to Neil's complaint that our market in housing has seriously distorted the housing benefit	1
Claire's a campaigner for more housing	Claire has an answer to Neil's complaint that the market in housing has seriously distorted the housing benefit	0
Claire wants more housing	Claire's argued that we should build over green belt	0
Claire's a campaigner for more housing	Claire's argued that we should build over green belt	0
there is a lack of recognition that there’s anything sapping away at the moral of young people in particular, who are dependent on the State.	that would not reduce the amount we spend on housing benefit	2
we should not talk about externalities, we should talk about internalities	The problem with compelling people to work, is that it suggests that the problem is that people do not wish to work	1
the argument that Anne was raising “Let’s not talk about externalities, let’s talk about internalities” as it were, misses the point	we should not talk about externalities, we should talk about internalities	1
it’s a way of transforming the moral issue from a lack of jobs, a lack of a provision, to an internal failure to do that	the argument that Anne was raising “Let’s not talk about externalities, let’s talk about internalities” as it were, misses the point	0
it’s a way of transforming the moral issue from a lack of jobs, a lack of a provision, to an internal failure to do that	there is an internal failure in some cases	1
there’s always a problem with any moral argument that says there is an innate desire to do things	some people have an innate desire, so called, to work harder than others	1
there’s always a problem with any moral argument that says there is an innate desire to do things	one of the jobs that the welfare system is quite reputably there to do, is to try and encourage the best of people, and to encourage the best that they can do	0
there’s always a problem with any moral argument that says there is an innate desire to do things	there is an internal failure in some cases	0
there are some things that are difficult; the housing market is one of them	one of the jobs that the welfare system is quite reputably there to do, is to try and encourage the best of people, and to encourage the best that they can do	0
one of the jobs that the welfare system is quite reputably there to do, is to try and encourage the best of people, and to encourage the best that they can do	you don’t get round everything about what you should about welfare dependency and welfarism by just saying “Well I’m sorry, but I can’t deliver the revolution tomorrow.”	0
If they’re going to be of working age, able bodied, and if they’re going to get benefits; they should not be allowed just to sit at home on benefits	What is vital is that people should be able to be compelled from the earliest possible stage to work	0
KM's not in this business	one thing KM may not be aware of is just how much benefits have been cut already by inflation	0
 that is not enough	What is vital is that people should be able to be compelled from the earliest possible stage to work	0
that would be a good way of incentivising work	we could turn our tax credits, which aren’t really tax credits in the UK, into something you only get paid if you’re working	0
we’ve thought too much, funnily, about the financial incentives to work, and not enough about the conditionality in the system	we ask people to do nothing in return for their benefits	0
these programs from other countries, they work	they are right about that	0
they really reduce unemployment	these programs from other countries, they work	0
In one of the US states that went the furthest in this in diverting people from being on welfare, they managed at one point to reduce the number of people on benefits by 90%	they really reduce unemployment	0
when it reduces by 90%- what Neil meant is that they were all in low paid, part time jobs	If that’s the kind of job system that Neil wants, it seems to be a deeply immoral way of dealing with the quest of work, and how people should look at work	0
One is to change the balance of or the generosity of out of work beneifts, maybe spend more on in work benefits like tax credits and so on	we could turn our tax credits, which aren’t really tax credits in the UK, into something you only get paid if you’re working	0
One is to change the balance of or the generosity of out of work beneifts, maybe spend more on in work benefits like tax credits and so on	there are two different ways of improving the incentives to work	0
when it reduces by 90%- what Neil meant is that they were all in low paid, part time jobs	This is a huge opportunity that we’ve barely begun to explore in the UK system	1
in a situation where you’re looking after kids. Out of pride, you don't say “Well I’m not going to take benefits and force my children to suffer as a consequence of my own stubbornness.” 	in a situation, rather than taking benefits, rather than giving a speech, what I should do is I’ll do anything. I’ll take any bits and jobs I’ll do anything because I’m not going to be dependent, either on my parents or on the State; I want to grow up, be independent. I don’t want to be beholden to the State. I don’t want to sit there passively, and I’ll take a low paid, part time job	1
There will be a government supplied safety net	we’re not going to get rid of the welfare state	0
these people don't exist	some people are not working because they can make a penny more from giving up their job and living at home	1
It’s so unnatural	these people don't exist	0
There will be a government supplied safety net	therefore [you are going to provide money to these people	0
therefore [you are going to provide money to these people	you must require them to work	0
it’s not a problem making a penny more	some people are not working because they can make a penny more from giving up their job and living at home	1
you say, “You get benefits on the basis that you work.”	In Wisconsin, when they made this requirement, and they gave a lot of help to people in terms of childcare A]; [in Wisconsin they had a reduction in welfare roles of up to 90%	0
it leads to a dependency which may in itself just not be a good way to live, or not be a good thing to pass on to your children.	there are incentives inherent in housing benefit, particularly when its begun at an early age	0
This is often a working benefit	in itself this is undesirable	1
The reason we have so many people claiming housing benefit is because there isn’t the social housing	last year 93% of new claimants were in a household in which somebody worked	0
we spend about £20 billion as a nation on housing benefit	in itself there is / is not a danger there	2
in itself this is undesirable	in itself there is / is not a danger there	2
This is often a working benefit	last year 93% of new claimants were in a household in which somebody worked	0
The reason we have so many people claiming housing benefit is because there isn’t the social housing	There’s 5 million people languishing on social housing waiting lists	0
Merthyr Tydfil, in Wales has one of the highest unemployment rates in the country	they should just get on the bus to Cardiff	0
we’ve seen millions of people claiming incapacity benefit, being dependent on benefits, young people have a sense of entitlement from the state, rather than a sense of self-reliance	the old idea of welfarism as a safety net, has changed	0
they don't have a sense of entitlement from the state rather than a sense of self-reliance	we’ve seen millions of people claiming incapacity benefit, being dependent on benefits, young people have a sense of entitlement from the state, rather than a sense of self-reliance	1
Over a million people, young people, without work, it has a scarring impact	youth unemployment is a blight on our nation	0
They’re far more likely as a result to be unemployed in later life	Over a million people, young people, without work, it has a scarring impact	0
it was revealed, that for every nine jobseekers in Cardiff there was only one vacancy	they should just get on the bus to Cardiff	1
