t1	t2	type
it’s not particularly attractive	KM didn’t ask JB that	3
there’s a short-term relationship, but no necessarily a long term one	let’s not just call them ‘scroungers’	3
we’re not going to get rid of the welfare state	in itself there is / is not a danger there	3
There is plenty of evidence to say that there is depression amongst the unemployed.	it’s an interesting thought experiment to say that the young could survive on their own, because they’ve got the get up and go, and we should let the witnesses at it, is worth considering	3
the welfare state should be about what people need/what they deserve	the Department of Work and Pensions did a survey of people who have been on benefits a couple of years ago	3
if you have become unemployed and you’ve paid in in the past, you’ll get a more generous rate of benefits than people who haven’t paid in	abolishing housing benefit for under 25s will lead to staying with your mates	3
Before this recession, and forget whether Cameron is motivated by cuts or not, there was an ever increasingly welfare dependency	it must be the day job	3
it must be the day job	a punitive welfare state, a welfare state which attempts to socially engineer, attempts to prod and poke people ‘carrot and stick’ into work, is not sufficient to break this apparent perceived cycle	3
The way Neil would describe a lot of the people Neil's met who have been long term unemployed is kind of defeated, kind of depressed	it is ‘scroungers	3
that’s what William Beveridge wanted when he was designing the welfare state	JB wants to get rid of the welfare state, the welfare system	3
If people want to work, if it’s their nature to work, and if the work was there, then they’d go and do it	There is plenty of evidence to say that there is depression amongst the unemployed.	3
JB didn’t refer to utopia	housing benefit, particularly when paid out very young to so many young people, has a debilitating-	3
There is plenty of evidence to say that there is depression amongst the unemployed.	they really reduce unemployment	3
CF is not interested in Cameron making cuts	Anne's completely misunderstood the point of housing benefit	3
we need to encourage young people to see a third way, an alternative to that	that does seem to correspond to the reality	3
only since the welfare state has there been permanent unemployment	in itself this is undesirable	3
There is no natural condition of unemployment	a punitive welfare state, a welfare state which attempts to socially engineer, attempts to prod and poke people ‘carrot and stick’ into work, is not sufficient to break this apparent perceived cycle	3
a lot of young people sort of, had a sense of entitlement, which wasn't very healthy	the moral problem is that of how to provide incentives to get people off welfare, into work	3
it’s a very good point, Clifford’s just put Clifford's finger on it, about the fourth undeserving child or however many you want to put on the State’s payroll	it is not	3
we ask people to do nothing in return for their benefits	The problem isn’t lack of employment	3
it sort of goes back to the hypothetical couple living with their parents that Cameron spoke about in his speech on Monday. This couple who will say to Romin that I’m very angry that Romin sees these other people	If it were politically possible, JB would / would not want to abolish the welfare state altogether	3
they really reduce unemployment	the State is already helping them	3
you don’t get round everything about what you should about welfare dependency and welfarism by just saying “Well I’m sorry, but I can’t deliver the revolution tomorrow.”	The welfare state that we have at the moment here lacks a sense of ‘just desert’	3
If that’s the kind of job system that Neil wants, it seems to be a deeply immoral way of dealing with the quest of work, and how people should look at work	We can’t start dividing the population between the deserving and the undeserving	3
the current debate is about deflecting debate from those failures onto the supposed moral fecklessness of individuals	If people want to work, if it’s their nature to work, and if the work was there, then they’d go and do it	3
since this government’s come to power they’ve tried to exploit tensions in working class Britain between the working poor and the unemployed; between the non-disabled and the disabled; between private sector workers and public sector workers	we were just looking at the claimant count, a very narrow measure of unemployment	3
unemployment is a crime not a personal tragedy	Claire's no evidence for Claire's assertions	3
these programs from other countries, they work	there is a no utopia	3
politicians are not taking a moral stance over welfare reform	It’s creative	3
The real question is to ask “What is the best welfare state we can make, in the real world?”	There’s no free education	3
there’s the rub	the growth of what Claire calls ‘welfarism’ is to do with, firstly the disappearance of so many skilled middle income jobs; and secondly due to the failure to build social housing	3
we do not have the social circumstances to provide that for our young people.	it is not	3
That’s how JB regards it	a housing crisis, billions wasted on housing benefit lining the pockets of wealthy landlords because we stopped building social housing	3
that majority doesn't include CL	Neil's not trying to justify anything	3
it’s fair	people would require the social context in which work happens	3
the growth of what Claire calls ‘welfarism’ is to do with, firstly the disappearance of so many skilled middle income jobs; and secondly due to the failure to build social housing	Before this recession, and forget whether Cameron is motivated by cuts or not, there was an ever increasingly welfare dependency	3
It’s not overwhelming	it sort of goes back to the hypothetical couple living with their parents that Cameron spoke about in his speech on Monday. This couple who will say to Romin that I’m very angry that Romin sees these other people	3
it’s a problem that the sense of individual self-reliance, and standing on your own two feet and actually doing everything to avoid taking money from the state because you want to be politically independent and morally and individually independent has been sapped away at, chipped away at by the growth of welfarsim	In one of the US states that went the furthest in this in diverting people from being on welfare, they managed at one point to reduce the number of people on benefits by 90%	3
The problem with compelling people to work, is that it suggests that the problem is that people do not wish to work	many people are working who get it	3
that does seem to correspond to the reality	Before this recession, and forget whether Cameron is motivated by cuts or not, there was an ever increasingly welfare dependency	3
James made this very clear – James wasn’t blaming individuals	the system, if it has an impact, has an impact	3
there is a no utopia	There are benefits to work, obviously self-esteem, aspiration, sort of intangible goods which individuals feel	3
This is a huge opportunity that we’ve barely begun to explore in the UK system	one of the things that RS picked up when he was listening in the green room was about this idea of this demoralisation	3
they are right about that	we are just providing the work that people want to do	3
they were overwhelmed with tens of thousands of young people, desperate for work	individuals are not  feckless and lazy	3
that is not a particularly moral position to take	witnesses don't have an answer to that	3
in a situation where you’re looking after kids. Out of pride, you don't say “Well I’m not going to take benefits and force my children to suffer as a consequence of my own stubbornness.” 	What we do need to think about, are people’s incentives, and how you set up people’s incentives in the right way, that people do the right things	3
the young guy was smoking a lot of spliff	People move, in a life course, move in and out of work	3
JB's never referred to them being work shy	the Department of Work and Pensions did a survey of people who have been on benefits a couple of years ago	3
welfarism has become an all consuming be all and end all for a significant minority of society	JB didn’t refer to utopia	3
That’s the difference	Before this recession, and forget whether Cameron is motivated by cuts or not, there was an ever increasingly welfare dependency	3
that’s begging a lot of questions	it’s a very good point, Clifford’s just put Clifford's finger on it, about the fourth undeserving child or however many you want to put on the State’s payroll	3
They’re far more likely as a result to be unemployed in later life	Neil's not trying to justify anything	3
If that’s the kind of job system that Neil wants, it seems to be a deeply immoral way of dealing with the quest of work, and how people should look at work	At this current time, the current context without social housing, with 5 million people on social housing waiting lists, people - of course they should claim housing benefit, if they are unable to pay what are extortionate rents. Particularly in places like London	3
the sense of individual self-reliance, and standing on your own two feet and doing everything to avoid taking money from the state has not been chipped away at by the growth of welfarism	it is the knock down argument	3
it’s moved the furthest away of any of the industrialised countries from a contributory system where what you’ve paid in is what you get out	that argument is even stronger if the people you’re relying on are not your friends and family, but other people you don’t even know	3
we were just looking at the claimant count, a very narrow measure of unemployment	some people are not working because they can make a penny more from giving up their job and living at home	3
the young guy wasn’t turning up to work on time	we actually encourage people to become dependent on the state	3
There’s historically been some resistance from ordinary working class people to actually taking state benefits	If you took the people around this table this evening, and you took away all of our contacts, our qualifications our great jobs and so on, we’d still have more internal resources than that guy	3
there are lots of ways in which you can hopefully allow the market to create jobs	JB didn't say he wants to get rid of the welfare state, the welfare system	3
Kenyan cannot just do little policy bits to get Kenan off the argument	xxx is how we encourage the young	3
Anne misunderstands how housing benefit works	it’s only the right to a job that RS’d accept	3
one of the big initiatives that Romin's looking at, is the troubled families initiative; this idea that this hardcore of really difficult families that we need to look at	there’s two questions here	3
the old idea of welfarism as a safety net, has changed	 that is not enough	3
Anne's misunderstood the nature of housing benefit	there is a natural and normal desire to work	3
what we need to look at is we need to look at other ways of incentivising; making work pay. Looking at the barriers that exist for young people to get into work	it’s to do with a bunch of lazy scroungers dribbling on their sofas watching reflections of themselves on Jeremy Kyle	3
politicians are not taking a moral stance over welfare reform	abolishing housing benefit for under 25s will lead to homelessness, hidden homelessness, sofa surfing, staying with the wrong people	3
they should do xxx in order to look after their children	if there were twice as many jobs available, unemployment would fall drastically	3
people can be tempted out of work	I want to live in a London that doesn’t have high levels of crime	3
Kenyan cannot just do little policy bits to get Kenan off the argument	Owen wants to take housing benefit down	3
they are somehow or another demoralized and broken	the sense of individual self-reliance, and standing on your own two feet and doing everything to avoid taking money from the state has not been chipped away at by the growth of welfarism	3
there’s been a transfer	Owen is the champion of the working class	3
It’s also not the case that the idea of independence from the State, and character building is confined to the English public school system	If people want to work, if it’s their nature to work, and if the work was there, then they’d go and do it	3
KM didn’t ask JB that	you don’t get round everything about what you should about welfare dependency and welfarism by just saying “Well I’m sorry, but I can’t deliver the revolution tomorrow.”	3
that argument is even stronger if the people you’re relying on are not your friends and family, but other people you don’t even know	JB likens it to a mouse trap which has a rather stale piece of cheese in it	3
you say, “You get benefits on the basis that you work.”	that’s begging a lot of questions	3
Claire wants to encourage a society that treats people as grown ups; that allows them to grow up	we actually encourage people to become dependent on the state	3
they enjoy that	We have a minimum wage	3
the urge to get a job is overwhelming	there is a natural and normal desire to work	3
young people should go out and get something from the world, contribute something to the world. Instead of saying “Why can’t I get a well paid job? Why can’t I get a house?”	there seemed to be a germ of compassion about what Neil was saying	3
that’s not necessarily how the welfare state was ever intended to work, or the way it does work	that would be great	3
they really reduce unemployment	At this current time, the current context without social housing, with 5 million people on social housing waiting lists, people - of course they should claim housing benefit, if they are unable to pay what are extortionate rents. Particularly in places like London	3
we ask people to do nothing in return for their benefits	It does happen	3
we’ve thought too much, funnily, about the financial incentives to work, and not enough about the conditionality in the system	It’s so unnatural	3
youth unemployment is a blight on our nation	they found that 11% of people who were on benefits said that they felt fully justified being on benefits and have discovered that life without the added complication of work has much to recommend it	3
‘The Daily Telegraph’ pointed out there are 23 people chasing every job in this country	unemployment is a crime not a personal tragedy	3
the welfare state system is creating a whole class of work shy, people who are incentivised not to work	CF is interested in the demoralising impact of welfarism 	3
it is the knock down argument	One is to change the balance of or the generosity of out of work beneifts, maybe spend more on in work benefits like tax credits and so on	3
The official unemployment figure, again Neil has a point on this, is understating the real crisis	there is an internal failure in some cases	3
instead of wasting it lining the pockets of landlords it could be used to build housing which would stimulate the economy, create jobs, bring down the welfare bill, and bring down the social housing waiting lis	I want to live in a London that doesn’t have high levels of homelessness	3
It does happen	we’ve seen millions of people claiming incapacity benefit, being dependent on benefits, young people have a sense of entitlement from the state, rather than a sense of self-reliance	3
It’s so unnatural	That is not the world we live in	3
people are naturally creative and industrious, and want to work	the desire to work is innate	3
that is a not a bad thing	In JB's ‘non-utopia’ where he's abolished the welfare state, xxx is what happens to those 2 million	3
JB didn’t refer to utopia	youth unemployment is a blight on our nation	3
xxx is how JB regards it	a lot of young people sort of, had a sense of entitlement, which wasn't very healthy	3
the welfare state system is creating a whole class of work shy, people who are incentivised not to work	that argument is even stronger if the people you’re relying on are not your friends and family, but other people you don’t even know	3
I might not take back from the National Health Service or from the welfare state, the things that I put in, the money that I put in through my tax	it's not only the right to a job that RS'd accept	3
you get certain ‘social goods’ which are greater than that	I certainly get indirect effects; indirect goods.	3
What is important at this point is that there has to be a serious discussion about the impact of welfarism	JB blames the political system that has created a trap for these people	3
we are living in a country with a minimum wage	It’s so unnatural	3
the point about a welfare state is it was set up as a safety net, during a time of near full employment	the sense of individual self-reliance, and standing on your own two feet and doing everything to avoid taking money from the state has not been chipped away at by the growth of welfarism	3
If you’re going to work very hard for 8 hours a day, 5 days a week and you’re going to make only £1 more than you would have made on benefits the urge to get a job is not as strong as it would be if you’d otherwise be penniless	the young guy was smoking a lot of spliff	3
In most other countries there’s something like an unemployment insurance	the Department of Work and Pensions did a survey of people who have been on benefits a couple of years ago	3
JB would want to abolish the welfare state altogether	The reason we have so many people claiming housing benefit is because there isn’t the social housing	3
It’s not beyond the imagination to imagine the young might get up and go and do something about this, other than kind of sit and wait to be handed something.	JB didn’t say “Work shy”	3
We’d still be much better off	In one of the US states that went the furthest in this in diverting people from being on welfare, they managed at one point to reduce the number of people on benefits by 90%	3
they shouldn't resort to petty crime, rather than take benefits	it is ‘scroungers	3
we’ve done a lot to improve work incentives financially	At this current time, the current context without social housing, with 5 million people on social housing waiting lists, people - of course they should claim housing benefit, if they are unable to pay what are extortionate rents. Particularly in places like London	3
it is the knock down argument	it is / is not moral to ask people to work in a job that doesn’t really pay them that much more than being on benefits	3
The official unemployment figure, again Neil has a point on this, is understating the real crisis	the welfare system is the problem	3
James made this very clear – James wasn’t blaming individuals	they are right about that	3
JB's never referred to them being work shy	JB likens it to a mouse trap which has a rather stale piece of cheese in it	3
It creates a dependency on work	that’s part of the way God made people	3
welfarism has become an all consuming be all and end all for a significant minority of society	We kidded ourselves during the last decade that we’d solved the problem of unemployment,	3
Claire has no answer to Neil's complaint that our market in housing has seriously distorted the housing benefit	JB likens it to a mouse trap which has a rather stale piece of cheese in it	3
I might not take back from the National Health Service or from the welfare state, the things that I put in, the money that I put in through my tax	The official unemployment figure, again Neil has a point on this, is understating the real crisis	3
Anne's misunderstood the nature of housing benefit	That’s how JB regards it	3
JB didn’t say “Work shy”	we need to encourage young people to see a third way, an alternative to that	3
it’s moved the furthest away of any of the industrialised countries from a contributory system where what you’ve paid in is what you get out	that’s an ‘Aunt Sally’	3
If it were politically possible, JB would / would not want to abolish the welfare state altogether	instead of wasting it lining the pockets of landlords it could be used to build housing which would stimulate the economy, create jobs, bring down the welfare bill, and bring down the social housing waiting lis	3
JB blames the political system that has created a trap for these people	xxx is what JB will do	3
they’re not naturally lazy	the welfare state should be about what people need/what they deserve	3
I want to live in a London that doesn’t have high levels of homelessness	in itself this is undesirable	3
we’ve done a lot to improve work incentives financially	it is not moral when somebody is saying “I don’t want to move away from being dependent on other people for just any job; only a decent job with a very good wage, or an interesting job.”	3
when it reduces by 90%- what Neil meant is that they were all in low paid, part time jobs	JB would want to abolish the welfare state altogether	3
we’ve had the benefits, whatever they are, from our family of being set up in such a way that we understand the world of working and how to get on in life	many people are working who get it	3
It’s not beyond the imagination to imagine the young might get up and go and do something about this, other than kind of sit and wait to be handed something.	we’ll not further entrench the type of poverty	3
it’s requirement	the young guy’d lost his job at Tesco	3
the welfare state, as it is, is a safety net / is a trap	Nothing JB said implies that JB regards it as a crime	3
people do take those jobs	in itself there is / is not a danger there	3
Claire wants more housing	KM's not in this business	3
RS's kind of treating them as though they’re passive recipients of something	If you look at the wider measure of all the people on benefits: the people on incapacity benefit, the people on income support as well. Actually, even all the way through the years of the debt fuelled boom we had about 5 million people effectively workless	3
JB didn’t say “Work shy”	It’s due to a triple crisis	3
we do need to get back to this idea of desert	Claire has an answer to Neil's complaint that the market in housing has seriously distorted the housing benefit	3
they should really be angry with their government for not addressing the underlying social policy issues	Anne misunderstands how housing benefit works	3
when it reduces by 90%- what Neil meant is that they were all in low paid, part time jobs	we need to think about how to describe the problem, and understand the problem accurately	3
This guy’s just a scrounger, he needs a kick up the backside to get going	xxx is how we move from a policy that we’ve been pursuing for quite a long time, of trying to fight poverty mainly by giving people more in cash benefits, which solves the problem today, to a policy which is more about solving the problem over the long run by moving more people into work, reducing unemployment	3
that would not reduce the amount we spend on housing benefit	we do need to get back to this idea of desert	3
we’ve done a lot to improve work incentives financially	it’s an interesting thought experiment to say that the young could survive on their own, because they’ve got the get up and go, and we should let the witnesses at it, is worth considering	3
that is neither a moral nor a practical way forward	you put a pound in	3
It’s not beyond the imagination to imagine the young might get up and go and do something about this, other than kind of sit and wait to be handed something.	it is not	3
the problem is that welfarism has gone far beyond a safety net, or anything compassionate	that’s what William Beveridge wanted when he was designing the welfare state	3
I want to live in a London that doesn’t have high levels of homelessness	individuals are not  feckless and lazy	3
People have a moral duty to work to support themselves	that majority doesn't include CL	3
There’s no free education	therefore [you are going to provide money to these people	3
JB does not blame the people-	we’ve thought too much, funnily, about the financial incentives to work, and not enough about the conditionality in the system	3
One of the confusing things in Britain is that actually the overwhelming majority of what we call ‘tax credits’, about 30 of the £33bn a year we spend on them is actually spent on stuff that’s actually not at all linked to being in work	these things are in some sort of a balance	3
there is such a lot of evidence that it does have a distorting effect	Claire wants to encourage a society that treats people as grown ups; that allows them to grow up	3
you can’t blame the people who are rationally taking housing benefit when they can’t afford to pay their rent	lots of people are doing part time work	3
it is / is not moral to ask people to work in a job that doesn’t really pay them that much more than being on benefits	the problem is that welfarism has gone far beyond a safety net, or anything compassionate	3
there are too many people included in those categories	It’s due to a triple crisis	3
If you took the people around this table this evening, and you took away all of our contacts, our qualifications our great jobs and so on, we’d still have more internal resources than that guy	that is not a particularly moral position to take	3
people should do xxx in a place like Merthyr Tydfil	the State is subsidising employers who refuse to pay people decent wages	3
JB does not blame the people-	some people have an innate desire, so called, to work harder than others	3
there is very great danger here of stirring up resentment towards people who need welfare to keep house and home together	Claire's argued that we should build over green belt	3
